product name,product price,product info,store name,store phone number,store address
[折疊收納]懶人折疊桌,95,產品名稱：懶人折疊桌產品顏色：木紋展開尺寸：50x30x23cm折疊尺寸：50x30x5cm產品重量：約1290克產品材質：密度板+鋼管+塑料產 品用途：折疊桌組裝需求：無使用方法：展開即可使用產品產地：中國產品貨源：原廠公司貨保存方法：本產品請避光陰涼處存放。產品內容：懶人折疊桌x1,吉來小舖,未提供,未提供
adidas RUNFALCON 3.0 跑鞋 慢跑鞋 運動鞋,1094,RUNFALCON3.0跑鞋含有再生材質的避震跑鞋穿上這款百搭的adidas跑鞋，前往公園慢跑或漫步去咖啡廳。採用柔軟Cloudfoam中底，一穿 上就感覺舒適自如。網布鞋面舒適透氣，橡膠大底提供良好抓地力，幫助自信邁步。採用一系列再生材質製成，鞋面含有至少50%的再生 成分。此產品是我們協助終結塑膠廢料的解決方案之一。,adidas官方旗艦館,0800-487-487,蝦皮路333號
DE-291-1 DE-293 工作桌,1299,"商品型號：I-R-DE291-1胡桃色/I-R-DE293胡桃搭黑色商品尺寸：W120D60H121.5CM商品顏色：胡桃木色/胡桃搭黑色商品材質：厚1.5cm塑合板貼美耐皿+2*2cm烤漆鐵管組裝方式：需要自行組裝商品特色：加大桌面120公分寬60公分深.比市面120x48cm縮小版,作業更順手.書桌搭配書櫃的貼心設計簡約俐落設計，時尚具質感可當書桌、辦公桌、電腦桌美耐皿板，防水、防刮、耐磨，好整理,非市售貼紙/貼PVC不 耐刮,易吸水膨脹,發霉.配送說明：商品皆配送至同平面1樓組裝方式：需DIY組裝，請按照說明書上定期檢查及維護。",家昀國際暢貨中心,04-25651960,台中市大雅區龍善二街22號
Razer 雷蛇 BlackShark V2 X 黑鯊 電競耳機 3.5mm,1280,"產品特色1.高階音訊表現2.強化語音擷取3.輕盈記憶泡綿設計4.進階被動抗噪5.全面的沉浸感受與相容性產品介紹專為專業玩家打造RazerBlackSharkV2X讓你享有電競真正該有的聲音。經過Xbox官方授權，讓你體驗頂級音效的聽覺饗宴，享受通話清晰的麥克風，同時擁有完美聲音隔離能力的三重優勢。搭配我們最佳的耳麥與音訊驅動單體，讓你的遊戲主機電競體驗邁向嶄新境界。RAZERTRIFORCE50MM驅動單 體我們的尖端專利設計將驅動單體分成高音、中音和低音3個部分進 行個別帶來更豐富的高音、更強勁的低音，以及更為清晰明亮的中音。RAZERHYPERCLEAR心型指向麥克風改良後的收音模式會減少向麥克 風的背面和側面收音，確保所收到的語音更多、噪音更少，同時麥克風具備可彎折設計，可讓你輕鬆將麥克風彎到嘴邊，調整最適合收音的位置。極致舒適與專注度加厚的頭帶襯墊與人造皮革耳墊，給你柔軟舒適感受；封閉式柔軟耳罩提供優異的密閉空間，使隔音效果變得更好。可搭配WINDOWSSONIC使用逼真的環繞音效表現實現精準的聲音定位，強化你在遊戲中的感知能力。音量控制滾輪耳麥上配置控制鍵能讓你便利控制音量，不需調整系統或程式設定。跨平台透過3.5mm 音訊插孔，讓你在PC和其他熱門平台享受令人驚豔的遊戲音訊。產品規格反應頻率12Hz28kHz阻抗32(1kHz)靈敏度100dBSPL/mW,1kHz驅動 單體規格50公釐驅動單體類型RazerTriForce耳罩橢圓形耳墊/內耳罩直徑寬：43公釐/1.69吋長：63公釐/2.48吋耳墊材質標準透氣記憶泡綿耳墊抗噪進階被動抗噪能力連接類型類比式3.5mm纜線長度1.3公尺/4.27呎約略重量240公克/0.53磅麥克風樣式固定的可拆卸RazerHyperClear心型指向麥克風收音模式單向麥克風反應頻率100Hz-10kHz麥 克風靈敏度(@1KHZ)-42dBV/Pa,1kHz虛擬環繞音效編碼7.1聲道環繞音效（僅適用於64位元版本的Windows10）音量控制鍵耳罩音量調較按 鍵：提高/降低音量其他控制鍵耳罩上控制功能：麥克風靜音開關、 音量提高/降低按鍵電池續航力無燈光效果無相容性具備3.5mm音訊插孔的裝置注意事項賣場商品之詳細規格請依照官網為主商品到貨當日起享15天鑑賞(猶豫)期之權益注意！鑑賞期非試用期拆封時請全程錄影以確保自身權益！外箱破損、封口不平整請勿收件產品無瑕疵、無故障，但已拆封使用，因個人因素、喜好之原因而退貨，會酌收整新費用(最高30%)賣場皆含稅附發票，由蝦皮代開電子發票(統編請於結帳時填入)發票問題請電話聯繫蝦皮客服商品描述產品特色1.高階音 訊表現2.強化語音擷取3.輕盈記憶泡綿設計4.進階被動抗噪5.全面的沉浸感受與相容性產品介紹專為專業玩家打造RazerBlackSharkV2X讓你享有電競真正該有的聲音。經過Xbox官方授權，讓你體驗頂級音效的聽覺饗宴，享受通話清晰的麥克風，同時擁有完美聲音隔離能力的三重優勢。搭配我們最佳的耳麥與音訊驅動單體，讓你的遊戲主機電競體驗邁向嶄新境界。RAZERTRIFORCE50MM驅動單體我們的尖端專利 設計將驅動單體分成高音、中音和低音3個部分進行個別帶來更豐富 的高音、更強勁的低音，以及更為清晰明亮的中音。RAZERHYPERCLEAR心型指向麥克風改良後的收音模式會減少向麥克風的背面和側面收 音，確保所收到的語音更多、噪音更少，同時麥克風具備可彎折設計，可讓你輕鬆將麥克風彎到嘴邊，調整最適合收音的位置。極致舒適與專注度加厚的頭帶襯墊與人造皮革耳墊，給你柔軟舒適感受；封閉式柔軟耳罩提供優異的密閉空間，使隔音效果變得更好。可搭配WINDOWSSONIC使用逼真的環繞音效表現實現精準的聲音定位，強化你在遊戲中的感知能力。音量控制滾輪耳麥上配置控制鍵能讓你便利控制音量，不需調整系統或程式設定。跨平台透過3.5mm音訊插孔，讓你在PC和其他熱門平台享受令人驚豔的遊戲音訊。產品規格反應頻率12Hz28kHz阻抗32(1kHz)靈敏度100dBSPL/mW,1kHz驅動單體規格50公釐驅動單體類型RazerTriForce耳罩橢圓形耳墊/內耳罩直徑寬：43公釐/1.69吋長：63公釐/2.48吋耳墊材質標準透氣記憶泡綿耳墊抗噪進階被動抗噪能力連接類型類比式3.5mm纜線長度1.3公尺/4.27呎約略重量240公克/0.53磅麥克風樣式固定的可拆卸RazerHyperClear心型指向麥克風收音模式單向麥克風反應頻率100Hz-10kHz麥克風靈敏度(@1KHZ)-42dBV/Pa,1kHz虛擬環繞音效編碼7.1聲道環繞音效（僅適用於64位元 版本的Windows10）音量控制鍵耳罩音量調較按鍵：提高/降低音量其他控制鍵耳罩上控制功能：麥克風靜音開關、音量提高/降低按鍵電 池續航力無燈光效果無相容性具備3.5mm音訊插孔的裝置注意事項賣 場商品之詳細規格請依照官網為主商品到貨當日起享15天鑑賞(猶豫)期之權益注意！鑑賞期非試用期拆封時請全程錄影以確保自身權益！外箱破損、封口不平整請勿收件產品無瑕疵、無故障，但已拆封使用，因個人因素、喜好之原因而退貨，會酌收整新費用(最高30%)賣場 皆含稅附發票，由蝦皮代開電子發票(統編請於結帳時填入)發票問題請電話聯繫蝦皮客服",Razer雷蛇｜電競週邊館,0800-487487,蝦皮路333號
SADES DIABLO 暗黑鬥狼RGB REALTEK 電競耳麥 7.1 (USB) SA-916,2390,黑暗中閃耀的不只是我的利爪還有你即將流下的眼淚全球首發Realtek瑞昱電競耳機音效系統電競音效功能：擴闊音場/強化通話/高頻恢 復/自動音量調整反射式炫光RGB呼吸燈金屬伸縮軟管全向式降噪麥克風轉盤式快速音量控制超厚透氣美容級蛋白質耳罩**拍下發票(需達 指定金額以上)與耳機序號私訊粉絲團即送Jonsbo喬思伯時尚鋁合金 耳機架1個(紅/黑/銀3選1)(價值790)送完為止**贈品不在活動範圍內****以上原廠活動是針對消費者經銷商及特殊SI方案者不在範圍內賽德斯官方粉絲團擁有最終決策權**產品型號：SA-916揚聲器直徑：高傳真釹磁40mm單體頻率範圍：20-20.000Hz靈敏度：116dB+/-3dBat1kHz阻抗：32在1kHz最大輸出功率：20mW麥克風尺寸：4.0x1.5mm麥克 風靈敏度：-40dB+/-3dB麥克風頻率範圍：50-10kHz麥克風阻抗：2.2K在1kHz電線長度：Approx2.2公尺,筑蒂資訊有限公司,04-22216131,台灣省台中市中山路49巷11-2號
W202 人體工學椅,1460,"耐重粗鐵管腳+強化塑料框架結構穩實乘坐安全可靠椅背採優選透氣 網布，韌性高易拉伸不易斯裂高密度定型棉坐墊，柔軟舒適久坐當空間較小時或需搬動時可以瞬間收納，不佔空間體式折合桌椅輕便重量只有8KG,收納移動簡單便利已投保1000萬-產品責任險~讓您安心使用多分保障有實體店面，購買有保障規格材質：網布，泡棉，PP塑料，鋼管收合尺寸：寬62CM*高100CM*厚度25CM(詳細尺寸如圖所示手量尺寸正負2CM)展開尺寸：(詳細尺寸如圖所示手量尺寸正負2CM)商品重 量：8KG(單張)組裝：免組裝，圖片為組裝後之成品。",Xpanse旗艦店,未提供,未提供
世界上最透明的故事（日本出版界話題作，只有紙本書可以體驗的感動）,284,中文書/文學小說/懸疑/推理小說/日本懸疑/推理小說作者：杉井光 譯者：簡捷繪者：fusui出版社：皇冠出版日期：2024/09/30語言： 繁體中文享譽文壇的知名推理作家宮內彰吾罹癌過世。宮內在出版界緋聞不斷，明明已有妻小，卻仍然與眾多女性交往，更與其中一位生下了孩子，那就是我。宮內過世之後，他的長子主動聯絡我。他說宮內死前，好像還持續在撰寫一本名為《世界上最透明的故事》的小說。我那同父異母的哥哥看上高額的版稅，想將之作為遺作出版，無奈一直找不到手稿。身為書店員工，我知道知名作家過世，正是拓展銷量的機會，生前的作品將炙手可熱。起初我站在如此功利主義的角度思考，但在得知宮內寫作途中曾遭遇難以解釋的瓶頸後，對小說本身產生了好奇。在欲望與業報盡頭病倒的作家，臨死之際最後的依託世界上最透明的故事。我和編輯霧子小姐展開調查，尋找未曾謀面的生父的遺作。我們詢問了他的家人、編輯、情婦，然而隨著拼湊出來的父親形象逐漸清晰，我周遭的一切卻開始變得透明......驚動日本出版界的「那本話題作」絕對不可能猜到的結局閱畢後你的世界將徹底透明絕對不可能出成電子書只有紙本書可以體驗的感動在電子書崛起的時代，單憑紙本書，短短一年突破45萬冊！「看到」之後就回不去了，一生只能體驗一次的設計「在我的閱讀生涯中，只有一本書在閱讀完後讓我徹底目瞪口呆。我想帶給讀者像那本書一樣純粹又強烈的閱讀『體驗』。為此，我將這個點子寫成了故事，並透過許多人的協助，變成了一本書。這本書光是能出版，就稱得上是奇蹟了。」「要完美翻譯這本小說，全世界恐怕就只有臺灣辦得到了。感謝過程中所有締造奇蹟的相關人士。多謝！」杉井光作者譯者編輯，合謀獻給讀者的情書日本出版社再三確認：「你們真的做得出來嗎？」繁中版責編：「至今做了超過一百五十本書，這本書絕對是編涯最大挑戰之一。」繁中版譯者：「個人翻譯史上最沉重的鐐銬，任何譯者一輩子無法忘懷的書。」作者杉井光和日本責編的「聯手犯案」，由繁中版譯者和責編延續的「跨國犯罪」，經過無數討論和測試，終於完美還原所有細節！封面由日本插畫家「fusui」繪製插畫家fusui接下委託後表示：「我第一次讀小說讀到大叫。」在約十件的插畫提案中，最終選定現在的插畫製作封面。fusui以淡色筆觸表現故事的通透性，僅 僅一幅畫即描繪出故事的場景和巧思，讓讀者在閱讀前及閱畢後對於封面產生不同的感受。各領域愛書人努力不暴雷推薦編哭編笑社群經營者B編推理評論人及作家Faker冒業推書手L原生電子推理雜誌《PUZZLE》主編冬陽丹鳳高中圖書館主任、作家宋怡慧日劇譯者李冠潔譯 者泥蛙文字工作者臥斧流轉翻翻書流轉《小書痴的下剋上》譯者許紋寧（許金玉）閱讀書帳愛書人陳子楹演員陳妤推理作家陳浩基作家陳曉唯作家彭樹君書際探險家蛙蛙作家馮國瑄《黃色臉孔》譯者楊詠翔詩人導演盧建彰推理作家薛西斯小說家瀟湘神香港推理小說作家譚劍（按姓名筆畫序排列）「這部小說是只能透過紙本書施展的文字奇蹟，如果有人問：為何在數位浪潮裡我們堅持不放棄紙書？《世界上最透明的故事》就是答案。花三頓飯的時間完讀一本讓我在最後一頁忍不住驚呼的小說，這是世界上最美好的體驗。」編哭編笑社群經營者B編「自《火目的巫女》開始就有追看杉井光的小說，沒想到他會以 此作『二次出道』，躋身於推理作家的行列。這是一個關於愛的故事。是對推理小說的愛，是對紙本書的愛，更是對（後設）詭計的愛。《世界上最透明的故事》的『內』與『外』的故事都是因愛而生。而編輯和譯者費盡心思讓這部小說的中文版得以面世，同樣都是因為愛。」推理評論人及作家Faker冒業「身為一個電子書愛好者，經常有 人會問我為什麼無法割捨紙本書。以前的我都只能推給紙本書的氣味、觸感這些主觀感受。但現在的我能說：『如果不是紙本書，那麼這本充滿愛的書就不可能存在。』」推書手L「『匠心獨具』、『神乎 其技』的一部作品，除此之外我不知道該說什麼才不至於暴雷，只期待有更多人同我一樣，接受這本小說帶來的震撼與感動。」原生電子推理雜誌《PUZZLE》主編冬陽「一直被提醒『嚴禁暴雷』，但《世界上最透明的故事》絕對是偵探小說迷的福音。『透明』、『紙本書籍』代表什麼意義？緊張的情節可能隨時會崩掉你思考的弦。如果錯過了，你將失去顛覆閱讀極限的機會，一起來讀吧！」丹鳳高中圖書館主任、作家宋怡慧「《世界上最透明的故事》不只是推理小說，更是一本寫給出版業的情書。杉井光用驚人的執行力，將『紙本書』這個載體化為盛大詭計中的關鍵道具，強制讓讀者成為故事的一部分，讓我們在看到真相、認為這個詭計不可能達成時，驚覺自己就捧著那個『不可能』的成果。這是幾乎無法重現的詭計，只能在紙本書上存在，也或許只有用日文才能最自然地呈現。電子書籍化不可能，翻譯不可能看完原文書，我是這麼相信的。但皇冠出版社和譯者簡捷化不可能為可能，成功重現作者的犯行，將世界上最透明的證據送到台灣讀者手上。現在輪到你拿起這本書，一起成為這場『不可能的犯罪』的證人。」日劇譯者李冠潔「文風洗練、向來以多產與高品質著稱的輕小說名家杉井光，進軍文藝書市的神級話題作！小說家對讀者拋出的訊息，以世界上最透明的方式被溫柔地接住了。」譯者泥蛙「聲稱最透明卻讓你難以看透。意外失去母親，那位我認為非親非故，卻有血緣關係的大作家，留下血腥疑惑，教我在迷霧裡穿梭。心緒扭曲錯亂，實情卻透明？細節揭露時讓人充滿驚奇，這是只能用紙本呈現，非讀不可的厲害小說！」流轉翻翻書流轉「總有一些邪惡（褒義）的書籍需要看紙本，才能帶來最原汁原味的體驗。這本就是其中之一啦！身為譯者，最讓我驚嘆的是譯者對於文字的運用，而當讀者跟著主角抽絲剝繭，自己也慢慢的拼湊線索，謎底揭曉之時，隨之而來的感動與餘韻可謂非常強烈，務必自己一探究竟！」《小書痴的下剋上》譯者許紋寧（許金玉）「超級推！一個由作者、編輯與譯者三人建構出的透明故事，遠遠超過我對推理小說與紙本書的想像。透明帶來的無限延伸也讓我看見超越時間、空間的另一種形式的愛與關懷，同時身為紙本愛書人與推理迷的我，真的好愛這部小說啊！」閱讀書帳愛書人陳子楹「他讓讀者變成受害者！等等，不是你想的那樣這是作者、譯者、編輯聯手精心策劃獻給讀者的情書，即便過程中發現自己『已經中計』，閱讀到最後仍然樂在其中，畢竟這麼浪漫的驚喜，誰不會又哭又笑的原諒呢？」演員陳妤「本作的中文版可說是近乎奇蹟般的存在，不諳日語的讀者能夠欣賞原作引人入勝的劇情外，知悉真相後更可『細味』譯者和編輯努力下的成果，這種閱讀體驗可說是百年不遇，絕無僅有。」推理作家陳浩基「《世界上最透明的故事》的書名，對應中文有個奇妙的巧合性，文眼的『透明』亦可解釋為『曉悟』。『曉悟』，在某個瞬間，領會了悟其中的深意，將事情的底蘊由人的內心翻攪而起。看似荒誕的故事裡，總有著意外的契機，如同光穿透過人的生命，射入人的內心，將原以為的、錯以為的人事物，一瞬之間翻轉過來，或許仍有傾斜，但人已能看見從前未曾細看過的自己。」作家陳曉唯「讀到最後謎底揭曉的時候，我不禁在心中驚叫：不會吧？這是真的嗎？然後瘋狂地回翻前面的書頁不斷確認。啊啊啊是真的！竟然有這種事！太瘋狂了！哪一個正常的作家會想要寫這樣的一本書啊？翻譯這本書更簡直是不可能的任務，本書譯者到底是怎麼辦到的？太令人欽佩了！終於明白為什麼這本書只能閱讀紙本而絕對不可能出成電子書，也終於明白作者杉井光為什麼說這本書能出版就已經是奇蹟。真的沒有辦法介紹這本書，除非自己讀到最後，否則無法體會其中的驚人之處。所以只能說，Just讀it，然後一起驚叫吧！」作家彭樹君「這本推理小說超好玩！作者精心設計了『透明』詭計，讓讀者在字裡行間參與解謎，直到真相揭曉才恍然大悟，精彩結局亦完美回饋所有耐心推理的讀者。很高興這部在日本書界引起熱潮的獨特作品，如今也將為繁中讀者帶來極大樂趣，值得收藏！」書際探險家蛙蛙「一段離奇的尋父記！我的世界本來就沒有這個人！不顧家庭、風流的爸爸，他死了關我什麼事？事情越來越離奇，奇怪的迷陣。更可怕的是，事不關己的讀者，也被逼得涉身其中！猛然回頭，原來一切都是愛，愛就藏在細節裡。」作家馮國瑄「過世的渣男名作家emo私生子少年謎樣正妹編輯，數位時代下唯有『紙本書』媒材才能 實現的故事，是一封獻給紙本書的情書，也是對出版職人的禮讚！中文版成書本身也是巨大的奇蹟！！！」《黃色臉孔》譯者楊詠翔「敘述性詭計的本質，即是內容與形式的結合。然而所謂的『形式』是什麼？小說是形式、言語是形式、書是形式、紙也是形式。形式的邊界究竟可以推到多遠呢？在本作中可以感受到作家想尋求那個邊界盡頭的熱情，您也準備好同等程度的挑戰熱情了嗎！」推理作家薛西斯「要我說的話，《世界上最透明的故事》真是本驚人的工藝品。到底是怎樣的作者會想寫這樣的故事，又是怎樣的出版社才願意翻譯這本書？光是這本書存在於此，就足以讓人對出版業獻上敬意看完的讀者肯定能明白。」小說家瀟湘神「這本書有兩大可觀之處：1.前半部塑造了可能是史上獲最多男作家羡慕的推理作家宮內彰吾。2.後半部用了一個非常瘋狂、戀態（並無貶義）、驚天動地的文字創作手法，可比『漏字文』小說。如果你喜歡這種文字遊戲，本書和電影《鐵達尼號》一樣是『一生必須看一遍』，seeingisbelieving。除了作者，本 書譯者也非常了不起，我必須說聲『』。」香港推理小說作家譚劍,博客來,0800-487487,台中市西屯區文華路100號
羅技 Logitech H340 USB耳機麥克風,945,H340USBComputerHeadsetUBS隨插即用H340USB耳機麥克風具有簡易隨插即用USB-A連線功能，是完美的日常工作耳機麥克風。隔噪麥克風 可減少背景噪音，為VOIP和通話提供清晰的數位音訊。隔噪麥克風右側的麥克風可調整位置以獲得更好的收音效果，並隔離背景雜音。麥克風桿不使用時可以將其完全折入頭帶中。可調整頭帶配備旋轉安裝式泡棉耳墊的輕盈頭帶，讓您長時間使用也能享有舒適的音訊聆聽感受。USB-A連線USB提供簡單的隨插即用操作。只需將USB-A接頭插入 您的電腦，就能開始進行交談、聆聽音樂或遊玩遊戲。尺寸高度:160公釐寬度:175公釐深度:60公釐+B5重量:0.1公斤連接線長度:1.8公尺技術規格+B5麥克風類型:雙向輸入阻抗:22歐姆耳機靈敏度:115dB+/-3dB麥克風靈敏度:-42dBV/Pa+/-3dB耳機麥克風頻率響應:20Hz-20kHz麥克風頻率響應:100Hz-16KHz保固資訊2年有限硬體保固,筑蒂資訊有限公司,04-22216131,台灣省台中市中山路49巷11-2號
